ID	TITLE	NAME	RAM	COLOR	SCREEN SIZE
1940486	Smartphone LG Optimus L7 II Dual P716 Preto com Dual Chip, Tela de 4.3”, Android 4.1, Câmera 8MP, 3G, Wi-Fi, aGPS, Bluetooth e Cartão 4GB - Celular LG Optimus L7 II Dual	smartphone lg optimus l7 ii dual p716  com dual chip, tela de 		preto	Chip,4.3”,4.3”,4.1,4.1,8MP,3G,Wi-Fi,aGPS,
2277815	Smartphone Samsung Galaxy S4 Mini Duos Preto com Dual Chip, Tela 4.3", Android 4.2, Câmera 8MP e Processador Dual Core de 1.7 Ghz - Claro - Galaxy S4 Mini Duos	smartphone samsung galaxy s4 mini duos  com dual chip, tela 		preto	Chip,4.3","3.4
2961097	Smartphone  Samsung Galaxy S5 SM-G900M Branco com Tela 5.1", Android 4.4, 4G, Câmera 16MP e Processador Quad Core 2.5GHz	smartphone  samsung galaxy s5 sm-g900m  com tela 		branco	5.1","1.5
2961099	Smartphone  Samsung Galaxy S5 SM-G900M Dourado com Tela 5.1", Android 4.4, 4G, Câmera 16MP e Processador Quad Core 2.5GHz	smartphone  samsung galaxy s5 sm-g900m  com tela 		dourado	5.1","1.5
3031744	Smartphone LG L90 Dual D410 Preto com Tela de 4.7”, Dual Chip, Android 4.4, Câmera 8MP e Processador Quad Core de 1.2 GHz	smartphone lg l90 dual d410  com tela de 		preto	4.7”,4.7”,Chip,4.4,4.4,1.2
3076120	Smartphone  Samsung Galaxy Core Plus Branco com Tela 4.3", TV Digital, Dual Chip, Android 4.3, Processador Dual Core 1.2 Ghz e Câmera de 5MP	smartphone  samsung galaxy core plus  com tela 		branco	4.3","3.4
3507499	Smartphone Samsung Galaxy Pocket 2 Duos SM-G110B Branco com Dual Chip, Android 4.4, Wi-Fi, 3G, GPS, Câmera 2MP, FM, MP3 e Bluetooth	smartphone samsung galaxy pocket 		branco	Chip,4.4,4.4,Wi-Fi,3G,GPS,2MP,FM,
3507899	Smartphone  Samsung Galaxy S5 Duos SM-G900 Preto com Dual Chip,Tela 5.1", Android 4.4, 4G, Câmera 16MP e Processador Quad Core 2.5GHz	smartphone  samsung galaxy s5 duos sm-g900  com dual chip,tela 		preto	Chip,Tela5.1","1.5
3638254	Smartphone Samsung Galaxy Young 2 Duos G130M Branco com Tela 3.5", Dual Chip, Android 4.4, 3G, Wi-Fi, GPS, Rádio FM e Câmera de 3MP.	smartphone samsung galaxy young 		branco	3.5","5.3
3638255	Smartphone Samsung Galaxy Young 2 Duos G130M Cinza com Tela 3.5", Dual Chip, Android 4.4, 3G, Wi-Fi, GPS, Rádio FM e Câmera de 3MP.	smartphone samsung galaxy young 			3.5","5.3
3842557	Smartphone Alcatel One Touch Pop C7 Branco com Tela 5”, Dual Chip, Câmera 8MP, Android 4.2, 3G e Processador Quad Core de 1.3 Ghz - Vivo	smartphone alcatel one touch pop c7  com tela 		branco	5”,Chip,8MP,4.2,4.2,1.3
4174797	Smartphone Samsung Galaxy Win 2 Duos TV Branco com Dual Chip, Tela de 4.5", TV Digital, Android 4.4, Câm. de 5MP e Processador Quad Core de1.2 Ghz	smartphone samsung galaxy win 		branco	Chip,4.5","5.4
4174800	Smartphone Samsung Galaxy Ace 4 Duos G313M/DS Cinza com Tela de 4”, Dual Chip, Android 4.4, Câmera 5MP, 3G e Processador Dual Core de 1GHz	smartphone samsung galaxy ace 			4”,Chip,4.4,4.4,5MP,
4186072	Smartphone Samsung Galaxy A7 4G Duos SM-A700FD Branco com Dual Chip, Tela 5.5", 4G, Android 4.4, Câmera 13MP e Processador Octa Core	smartphone samsung galaxy a7 		branco	Chip,5.5","5.5
4188382	Smartphone Samsung Galaxy Ace 4 Duos G313M/DS Branco com Tela de 4”, Dual Chip, Android 4.4, Câmera 5MP, 3G e Processador Dual Core de 1GHz	smartphone samsung galaxy ace 		branco	4”,Chip,4.4,4.4,5MP,
4333921	Smartphone Samsung Galaxy E5 4G Duos E500M/DS Branco com Dual Chip, Tela 5" HD sAMOLED, Android 4.4, Câmera 8MP e Processador Quad Core 1.2GHz	smartphone samsung galaxy e5 		branco	Chip,"5
4382821	Smartphone Samsung Galaxy A5 4G Duos A500M/DS Dourado com Dual Chip, Tela 5", Android 4.4, Câm.13MP e Processador Quad Core 1.2GHz	smartphone samsung galaxy a5 		dourado	Chip,"5
4457760	Smartphone Desbloqueado Samsung Galaxy S6 Edge SM-G925I Verde com 64GB, Tela de 5.1", Android 5.0, 4G, Câmera 16 MP e Processador Octa Core	smartphone desbloqueado samsung galaxy s6 edge sm-g925i  com 		verde	64GB,5.1","1.5
4457762	Smartphone Samsung Galaxy S6 Edge SM-G925I Preto com 64GB, Tela de 5.1", Android 5.0, 4G, Câmera 16 MP e Processador Octa Core	smartphone samsung galaxy s6 edge sm-g925i  com 		preto	64GB,5.1","1.5
4457764	Smartphone Samsung Galaxy S6 Edge SM-G925I Branco com 64GB, Tela de 5.1", Android 5.0, 4G, Câmera 16 MP e Processador Octa Core	smartphone samsung galaxy s6 edge sm-g925i  com 		branco	64GB,5.1","1.5
4626851	Smartphone Microsoft Lumia 640XL Dual Preto com Windows Phone 8.1, Tela de 5.7", Dual Chip, 3G, Câmera 13MP e Processador Quad Core de 1.2 GHz	smartphone microsoft lumia 		preto	8.1,8.1,5.7","7.5
5409352	Smartphone Samsung Galaxy Win 2 Duos TV G360BT Cinza com Dual Chip, Tela de 4.5", TV Digital, Android 4.4, Câm. de 5MP e Processador Quad Core 1.2 GHz	smartphone samsung galaxy win 			Chip,4.5","5.4
5409353	Smartphone Samsung Galaxy Win 2 Duos TV G360BT Branco com Dual Chip, Tela de 4.5", TV Digital, Android 4.4, Câm. de 5MP e Processador Quad Core 1.2GHz	smartphone samsung galaxy win 		branco	Chip,4.5","5.4
6034913	Smartphone Positivo Quattro X435 Preto com Dual Chip, Tela 5”, Android 5.1, Câmera 5MP, 4G, Wi-Fi, Bluetooth e Processador Quad Core 1.0GHz	smartphone positivo quattro x435  com dual chip, tela 		preto	Chip,5”,5.1,5.1,5MP,4G,Wi-Fi,1.0GHz
7259387	Smartphone LG K4 Indigo com 8GB, Dual Chip, Tela de 4.5", 4G, Android 5.1, Câmera 5MP e Processador Quad Core de 1GHz	smartphone lg k4  com 		indigo	8GB,Chip,4.5","5.4
7259389	Smartphone LG K10 TV Índigo com 16GB, Dual Chip, Tela de 5.3" HD, 4G, Android 6.0, Câmera 13MP e Processador Octa Core de 1.14 GHz	smartphone lg k10 tv índigo com 			16GB,Chip,5.3""3.5
7528302	Smartphone Multilaser MS50 Colors Preto com Tela 5.0”, Dual Chip, Android 5.0, Câmera 8MP, Wi-Fi, 3G, Bluetooth e Processador Quad Core de 1.3 GHz	smartphone multilaser ms50 colors  com tela 		preto	5.0”,5.0”,Chip,5.0,5.0,8MP,Wi-Fi,3G,1.3
7528303	Smartphone Multilaser MS50 Colors Branco com Tela 5.0”, Dual Chip, Android 5.0, Câmera 8MP, Wi-Fi, 3G, Bluetooth e Processador Quad Core de 1.3 GHz	smartphone multilaser ms50 colors  com tela 		branco	5.0”,5.0”,Chip,5.0,5.0,8MP,Wi-Fi,3G,1.3
7528304	Smartphone Multilaser MS50 Senior Preto com Tela 5.0”, Dual Chip, Android 5.0, Câmera 8MP, Wi-Fi, 3G, Bluetooth e Processador Quad Core de 1.3 GHz	smartphone multilaser ms50 senior  com tela 		preto	5.0”,5.0”,Chip,5.0,5.0,8MP,Wi-Fi,3G,1.3
7923488	Smartphone ASUS Zenfone II ZE551 16GB 4G Tela 5.5 ZE551ML-6C705WW - BVOLT	smartphone asus zenfone ii ze551 			5.5
8105618	Smartphone Asus Zenfone 2 ZE551ML, 4G Android 5.0 Intel Quad Core 2.3GHz 16GB Câmera 13MP Tela 5.5, Dourado	smartphone asus zenfone 		dourado	ZE551ML,5.02.3GHz5.5,5.5,
10029373	Violão Infantil Acústico Nylon Michael Vm10e Bk 1/4 Preto	violão infantil acústico nylon michael vm10e bk 		preto	
10029794	Playground Modular Advanced - Xalingo	Playground Modular Advanced - Xalingo			
10078038	Playground Modular Adventure - Xalingo	Playground Modular Adventure - Xalingo			
10080076	Playground Modular Future - Xalingo	Playground Modular Future - Xalingo			
10111398	Memoria 4gb Ddr3 1333 Kvr13n9s8/4 Kingston	memoria 			
10119246	Headphone Sense Oex Hp-100 Preto	Headphone Sense Oex Hp-100 Preto		preto	
10156714	Colar Masculino Couro Zíper E Caveira Preto	Colar Masculino Couro Zíper E Caveira Preto		preto	
10158095	Colar Masculino Em Couro Pingentes Preto	Colar Masculino Em Couro Pingentes Preto		preto	
10169722	Bumper Ero Original Samsung Galaxy S3 Siii I9300 + Pingente Laço (Bd11)	Bumper Ero Original Samsung Galaxy S3 Siii I9300 + Pingente Laço (Bd11)			
10172238	Bumper Ero Original Samsung Galaxy S3 Siii I9300 + Pingente Laço (Bd13)	Bumper Ero Original Samsung Galaxy S3 Siii I9300 + Pingente Laço (Bd13)			
10172241	Bumper Ero Original Samsung Galaxy S3 Siii I9300 + Pingente Laço (Bd12)	Bumper Ero Original Samsung Galaxy S3 Siii I9300 + Pingente Laço (Bd12)			
10172251	Bumper Ero Original Samsung Galaxy S3 Siii I9300 + Pingente Laço (Bd10)	Bumper Ero Original Samsung Galaxy S3 Siii I9300 + Pingente Laço (Bd10)			
10174707	Película Vidro Temperado Lg G4 / Dual Proteção Máxima Invisível Alta Definição - Husky	Película Vidro Temperado Lg G4 / Dual Proteção Máxima Invisível Alta Definição - Husky			
10201171	Anabolizante Capilar 1kg Forever Liss	anabolizante capilar 			
10206264	Tablet Multilaser M7s Quad Core Wi fi 7 Preto Nb184	tablet multilaser m7s quad core wi fi 		preto	
10229203	Memória Kingston Hyperx Savage 4gb 1600mhz Ddr3 Cl9 Vermelha Hx316c9sr/4	memória kingston hyperx savage 			
10229279	Memória 4gb Ddr3 Kingston Hyperx Fury 1600mhz Vermelho (Hx316c10fr/4)	memória 			
10229375	Tablet Samsung Galaxy Tab A 4g Sm-P355m,8,16gb,Câmera 5mp, Android 5.0,Quad Core 1.2 Ghz  Branco	tablet samsung galaxy tab a 		branco	Sm-P355m,Sm-P355m,Sm-P355m,5mp,5.0,Quad5.0,Quad1.2
10230494	Memória 8Gb (1X8gb) Ddr3 1866Mhz Hyperx Fury Black Hx318c10fb/8 Kingston	memória 			
10231173	Memoria Kingston HYPER X FURY RED DESK 8GB DDR3 1866 HX318C10FR/8	memoria kingston hyper x fury red desk 			
10231219	Memoria Desktop Gamer Hyperx Ddr3 Fury 8gb 1600mhz Ddr3 Non-Ecc Cl10 240-Pin Udimm Blue - Kingston	memoria desktop gamer hyperx ddr3 fury 			
10231221	Memoria Desktop Gamer Hyperx Ddr3 Fury 8gb 1600mhz Ddr3 Non-Ecc Cl10 Udimm Black - Kingston	memoria desktop gamer hyperx ddr3 fury 			
10231251	Memoria Desktop Gamer Hyperx Ddr3 Fury 4gb 1866mhz - Kingston	memoria desktop gamer hyperx ddr3 fury 			
10231290	Memoria Desktop Gamer Hyperx Ddr3 Fury 4gb 1600mhz Ddr3 Non-Ecc Cl10 240-Pin Udimm Red - Kingston	memoria desktop gamer hyperx ddr3 fury 			
10272343	Colar Masculino Couro Pingentes Crucifixo E Nossa Senhora Aparecida Preto	Colar Masculino Couro Pingentes Crucifixo E Nossa Senhora Aparecida Preto		preto	
10365719	Cabo Hdmi X Dvi 1.8 Metros Hdmi 1.4 10,2 Gbps	cabo hdmi x dvi 			1.81.410,2
10370558	Cabo Usb Retrátil  3 Adaptadores Preto - Muvit	cabo usb retrátil  		preto	
10370833	Memory Foam Playthru (Estojo Para Nds Preto) Lat	Memory Foam Playthru (Estojo Para Nds Preto) Lat		preto	
10380246	Fone Com Microfone Phn-M82mv/Bk Com Cont. Volume Mymax Preto	Fone Com Microfone Phn-M82mv/Bk Com Cont. Volume Mymax Preto		preto	Cont.
10381921	Ssd Gamer Hyperx Kingston Savage 240gb 2.5 Sata Iii Shss37a/240g	ssd gamer hyperx kingston savage 			2.5
10382119	Refil Plástico Para Álbum 16x22 Com 2 Divisórias E 10 Unidades Rsm003 - Toke E Crie	refil plástico para álbum 			
10382282	Refil Plástico Para Álbum 32x32 Com 6 Divisórias E 10 Unidades Rsm005 - Toke E Crie	refil plástico para álbum 			
10392692	Headset Groove Hp102 Preto Oex	Headset Groove Hp102 Preto Oex		preto	
10396396	Projetor Optoma Br331 Full-Hd 3d 3200 Lumens	projetor optoma br331 full-hd 			
10402534	Fonte Compativel Hp Compaq Tc4200 Tc4400 Tablet Pc - 18.5v	fonte compativel hp compaq tc4200 tc4400 tablet pc - 			18.5v
10402648	Fonte Compativel Hp Elitebook 8730w Mobile - 18.5v	fonte compativel hp elitebook 			18.5v
10404096	Fonte Compativel Hp Mobile Nw8440 Nw9440 Mobile - 18.5v	fonte compativel hp mobile nw8440 nw9440 mobile - 			18.5v
10413451	Fogão Delplus 5 Preto - Bivolt	fogão delplus 		preto	
10413556	Freezer/Refrigerador Horizontal Venax CHDM Degelo Manual 300L Preto - SE	freezer/refrigerador horizontal venax chdm degelo manual 		preto	
10413557	Freezer/Refrigerador Horizontal Venax CHDM Degelo Manual 300L Preto - SE	freezer/refrigerador horizontal venax chdm degelo manual 		preto	
10417343	Braçadeira Esportiva Para Iphone 4, 4s, 5, 5s, 5c E Smartphone Até 12,5 X 6 Cm - Preta	braçadeira esportiva para iphone 			4,4s,5,5s,12,5
10425358	Fonte Compativel Hp Compaq 8510w 8710w Mobile Workstation - 18.5v	fonte compativel hp compaq 			18.5v
10431793	Fogão Picasso 5 Inox - Bivolt	fogão picasso 			
10431849	Fogão Picasso 6 Inox - Bivolt	fogão picasso 			
10436409	Bastão Para Selfie Retrátil Com Controle Bluetooth Embutido Para Ios E Andriod - Preto	Bastão Para Selfie Retrátil Com Controle Bluetooth Embutido Para Ios E Andriod - Preto		preto	
10437999	Tênis Puma Cabana Racer Sl Infantil Branco / Preto 36	tênis puma cabana racer sl infantil  /  		preto	
10438245	Braçadeira Esportiva Para Iphone 6 E Smartphone Até 14 X 8 Cm - Preta	braçadeira esportiva para iphone 			
10443255	Placa Mae Gigabyte Core i3 i5 i7 1150 Aud Vid LAN µATX GA-H81M-S3PH	placa mae gigabyte core i3 i5 i7 			
10443720	Computador Neologic NLI48161 Intel Core i5-4440 4GB 500GB + Monitor 21,5" Linux	computador neologic nli48161 intel core i5-4440 			21,5""5,12
10443723	Computador Neologic NLI48171 Intel Core i5-4440 4GB 500GB + Monitor 21,5" Windows 7	computador neologic nli48171 intel core i5-4440 			21,5""5,12
10443830	Coqueteleira Fume 700ml - Probiótica	coqueteleira fume 			
10443869	Violão Eagle Folk Ch887 Bk Preto Aço Elétrico C Afinador	Violão Eagle Folk Ch887 Bk Preto Aço Elétrico C Afinador		preto	
10443928	Violão Elétrico Jumbo Aço Hofma Ye223 Bk Preto C Afinador	Violão Elétrico Jumbo Aço Hofma Ye223 Bk Preto C Afinador		preto	
10444009	Violão Folk Hofma Ye220 Bk Preto 220 Aço C Afinador	violão folk hofma ye220 bk  		preto	
10444060	Computador Neologic NLI48181 Intel Core i5-4440 4GB 500GB + Monitor 21,5" Windows 8	computador neologic nli48181 intel core i5-4440 			21,5""5,12
10444259	Violão Elétrico Nylon Hofma Ye230 Bk Preto C Afinador	Violão Elétrico Nylon Hofma Ye230 Bk Preto C Afinador		preto	
10444438	Computador Neologic NLI48170 Intel Core i5-4440 4GB 1TB + Monitor 21,5" Windows 7	computador neologic nli48170 intel core i5-4440 			21,5""5,12
10444439	Computador Neologic NLI48172 Intel Core i5-4440 8GB 500GB + Monitor 21,5" Windows 7	computador neologic nli48172 intel core i5-4440 			21,5""5,12
10444768	Computador Neologic NLI48180 Intel Core i5-4440 4GB 1TB + Monitor 21,5" Windows 8	computador neologic nli48180 intel core i5-4440 			21,5""5,12
10444806	Computador Neologic NLI48182 Intel Core i5-4440 8GB 500GB + Monitor 21,5" Windows 8	computador neologic nli48182 intel core i5-4440 			21,5""5,12
10446149	Cueca Slip Cotton	Cueca Slip Cotton			
10457331	Richée Argan e Ojon Shampoo Antirresíduo 700ml	richée argan e ojon shampoo antirresíduo 			
10458741	Computador Neologic NLI48176 Intel Core i5-4440 8GB 500GB Windows 7	computador neologic nli48176 intel core i5-4440 			
10459125	Computador Neologic NLI48196 Intel Core i5-4440 8GB 500GB Windows 8	computador neologic nli48196 intel core i5-4440 			
10459136	Computador Neologic Intel I5-4440 3.1ghz, HD 500Gb, 4gb Ram, Linux NLI48166	computador neologic intel i5-4440 	4gb		3.1ghz,3.1ghz,500Gb,Ram,
10459201	Computador Neologic NLI48195 Intel Core i5-4440 4GB 500GB Windows 8	computador neologic nli48195 intel core i5-4440 			
10459202	Computador Neologic NLI48165 Intel Core i5-4440 4GB 1TB Linux	computador neologic nli48165 intel core i5-4440 			
10459334	Computador Neologic NLI48174 Intel Core i5-4440 4GB 1TB Windows 7	computador neologic nli48174 intel core i5-4440 			
10461103	Bag Ibox Bb200 Contrabaixo Preto	Bag Ibox Bb200 Contrabaixo Preto		preto	
10462958	Forever Liss Force Repair Shampoo Rep 1 Lt	forever liss force repair shampoo rep 			
10464275	Ração Nd Gf Frango Cães Filhotes Raças Médias - 10,0kg	ração nd gf frango cães filhotes raças médias - 			10,0kg
10467267	Fi-7260 - Fujitsu-Scr A4 60ppm/120ipm	fi-7260 - fujitsu-scr a4 			
10469428	Mala Art Deco Com Rodinhas Em Vinil - 53x35 Cm	mala art deco com rodinhas em vinil - 			
10471631	Lowell Bioplastia Capilar Shampoo Reconstrutor 240ml	lowell bioplastia capilar shampoo reconstrutor 			
10471711	Probelle Shampoo Force Relax - 1000ml	probelle shampoo force relax - 			
10474045	Suporte Veicular Volante Celular Carro Gps Smartphone Iphone   Preto/Vermelho  Preto/Vermelho  Preto/Vermelho  Preto/Vermelho  Único  Único  Único  Único	Suporte Veicular Volante Celular Carro Gps Smartphone Iphone   Preto/Vermelho  Preto/Vermelho  Preto/Vermelho  Preto/Vermelho  Único  Único  Único  Único		preto	
10474951	Orofluido Shampoo - 1000ml	orofluido shampoo - 			
10477457	Corretivo Soft Claríssimo 00 - Dailus	corretivo soft claríssimo 			
10482309	Dominó Tradicional - Ciabrink	Dominó Tradicional - Ciabrink			
10482339	Alinhavos - Ciabrink	Alinhavos - Ciabrink			
10488575	Colágeno Clinical Skin (300g) - Body Action	Colágeno Clinical Skin (300g) - Body Action			
10488593	Disco Flash DTC 2767	disco flash dtc 			
10489339	Toner Samsung Clp 325 | Clx3185fw | Y407s Yellow Compatível	toner samsung clp 			
10493017	Schwarzkopf Professional 3D Men Root Activator - Shampoo 250ml	schwarzkopf professional 			
10496932	Botão Adesivo Coração Iphone-Ipad	Botão Adesivo Coração Iphone-Ipad			
10497608	Shampoo BC Bonacure Scalp Deep Cleansing Schwarzkopf 200ml	shampoo bc bonacure scalp deep cleansing schwarzkopf 			
10499130	Colchão Casal King Verticoil Smart Preto Sistema c/ Antifungo e Antialérgico - (193x203x23 cm)	Colchão Casal King Verticoil Smart Preto Sistema c/ Antifungo e Antialérgico - (193x203x23 cm)		preto	
10502867	Splitter Hdmi 1.3 1 Entrada X 4 Saídas Preto Pix	splitter hdmi 		preto	1.3
10503182	Switch Intelbras Sg800c 8 Portas 10/100/1000 Mbps Gigabit - 4005064	switch intelbras sg800c 			
10503773	Cabo Usb 10 Saídas	cabo usb 			
10511067	Capa Samsung Galaxy S3 Mini TPU Preto	Capa Samsung Galaxy S3 Mini TPU Preto		preto	
10511106	Capa Samsung Galaxy Gran Duos Tpu Preto	Capa Samsung Galaxy Gran Duos Tpu Preto		preto	
10511493	Batom Vult	Batom Vult			
10511494	Vult Batom 3,5g	vult batom 			3,5g
10511667	Batom Líquido Vult Matte 05	batom líquido vult matte 			
10511671	Batom Líquido Vult Matte 06	batom líquido vult matte 			
10511688	Batom Vult 05	batom vult 			
10511912	Batom Vult Nº55	Batom Vult Nº55			
10511920	Batom Vult Nº66	Batom Vult Nº66			
10512043	Batom Vult Nº41	Batom Vult Nº41			
10515031	Capa Samsung Galaxy S4 Mini Preto	Capa Samsung Galaxy S4 Mini Preto		preto	
10515587	Colchão Casal Padrão Verticoil Smart Preto Sistema C/ Antifungo E Antialérgico - (138x188x23 Cm)	Colchão Casal Padrão Verticoil Smart Preto Sistema C/ Antifungo E Antialérgico - (138x188x23 Cm)		preto	
10515599	Batom Líquido Vult Matte 01	batom líquido vult matte 			
10515674	Colchão Casal Queen Verticoil Smart Preto Sistema C/ Antifungo E Antialérgico - (158x198x23 Cm)	Colchão Casal Queen Verticoil Smart Preto Sistema C/ Antifungo E Antialérgico - (158x198x23 Cm)		preto	
10515777	Barzinho Campbell 100 Mdf Com Rodízios E Porta Garrafa - Preto Arizona	barzinho campbell 		preto	
10515789	Colchão Solteiro Padrão Verticoil Smart Preto Sistema c/ Antifungo e Antialérgico - (88x188x23 cm)	Colchão Solteiro Padrão Verticoil Smart Preto Sistema c/ Antifungo e Antialérgico - (88x188x23 cm)		preto	
10515990	Colchão Solteiro Verticoil Smart Preto Sistema c/ Antifungo e Antialérgico - (78x188x23 cm)	Colchão Solteiro Verticoil Smart Preto Sistema c/ Antifungo e Antialérgico - (78x188x23 cm)		preto	
10517578	Refil Para Toner Samsung Ml 3710 | Scx 5637 250g	refil para toner samsung ml 			
10519710	Celular Blu Samba Jr Q53 Prata Dual Chip Silver	Celular Blu Samba Jr Q53 Prata Dual Chip Silver		prata	
10524313	Mini Massageador Supermedy Com Usb Preto	Mini Massageador Supermedy Com Usb Preto		preto	
10532854	Carregador Veicular Combo - Veicular Power Bank E Lanterna. Cor Preto	Carregador Veicular Combo - Veicular Power Bank E Lanterna. Cor Preto		preto	Lanterna.
10534201	Capa Samsung Pocket Neo Tpu Preto	Capa Samsung Pocket Neo Tpu Preto		preto	
10535189	Capa Samsung Pocket Neo Tpu Transparente	Capa Samsung Pocket Neo Tpu Transparente			
10542369	Shampoo Dove Men  Care Limpeza Refrescante 200ml	shampoo dove men  care limpeza refrescante 			
10547514	Bumper Motorola Moto G Branca	Bumper Motorola Moto G Branca			
10548357	Bumper Samsung Galaxy S5 Azul	Bumper Samsung Galaxy S5 Azul		azul	
10553279	Bracadeira Samsung Galaxy Alpha	Bracadeira Samsung Galaxy Alpha			
10553333	Bracadeira Samsung Galaxy A3	Bracadeira Samsung Galaxy A3			
10553971	Bracadeira Motorola Moto E	Bracadeira Motorola Moto E			
10554154	Bracadeira Motorola Moto X	Bracadeira Motorola Moto X			
10554218	Sensor Temperatura Painel Iguaçu 26-220, 26-300, 4	sensor temperatura painel iguaçu 			26-220,26-300,
10554268	Sensor Maf - 7168 - Mte-Thomson	sensor maf - 			
10554506	Bracadeira Samsung Galaxy S4 Mini	Bracadeira Samsung Galaxy S4 Mini			
10555253	Schwarzkopf Osis Magic Finish Sérum 50ml	schwarzkopf osis magic finish sérum 			
10556101	Interface Celular Intelbras Quad Band Central Telefonica Itc 4100	interface celular intelbras quad band central telefonica itc 			
10556362	Clips 8/0 500g 180 Un - Bacchi	clips 			
10556457	Clips Galvanizados Ref.2 500G. Bacchi	clips galvanizados ref.2 			Ref.2500G.
10556749	Paliteiro Plástico - Plasútil	Paliteiro Plástico - Plasútil			
10557649	Bracadeira Samsung Galaxy S5 Mini	Bracadeira Samsung Galaxy S5 Mini			
10562893	Bumper Motorola Moto G2 Amarelo	Bumper Motorola Moto G2 Amarelo			
10571628	Capa Samsung Galaxy S5 Mini Tripla Proteção Preto	Capa Samsung Galaxy S5 Mini Tripla Proteção Preto		preto	
10573961	Avene Compacto Sable 50 10g	avene compacto sable 			
10578090	Base Líquida HD Koloss 30g	base líquida hd koloss 			
10578166	Pó Facial HD Koloss	Pó Facial HD Koloss			
10578667	Joico Moisture Recovery Shampoo 300ml	joico moisture recovery shampoo 			
10579361	Schwarzkopf Professional 3D Men Deep Cleansing - Shampoo 1000ml	schwarzkopf professional 			
10579453	Schwarzkopf 3Dmension Shampoo Antioliosidade - 250ml	schwarzkopf 			
10580772	Capa Transparente Iphone 4g/S - Cristal Flexível Premium	capa transparente iphone 			
10585987	Batom Líquido Matte Tracta	Batom Líquido Matte Tracta			
10586058	Batom Líquido Matte Tracta 8. Tweet Batom	batom líquido matte tracta 			8.
10586062	Batom Líquido Matte Tracta	Batom Líquido Matte Tracta			
10586065	Batom Líquido Matte Tracta 4,2mL	batom líquido matte tracta 			4,2mL
10586075	Batom Rouge Velvet	Batom Rouge Velvet			
10586230	Batom HD Matte Tracta 61. Sedeu&ccedil;&atilde;o B	batom hd matte tracta 			61.
10588803	Capa Samsung Galaxy Fame Lite Tpu Preto	Capa Samsung Galaxy Fame Lite Tpu Preto		preto	
10589445	Corretivo Líquido Tracta 7g	corretivo líquido tracta 			
10591150	Canudo Frutas Com 10 Unidades Strawplast	canudo frutas com 			
10591787	Tag Coleção Vintage - Canvas	Tag Coleção Vintage - Canvas			
10594130	Capacete Liberty Three For Girls - Preto	Capacete Liberty Three For Girls - Preto		preto	
10596046	Memoria 4gb 2x 2gb Compaq Pavilion Hdx16t Ddr2-800 Pc2-6400 Notebook	memoria 			
10597519	Grade Hilux SRV 2009 2010 2011 Cinza Moldura Cromada	grade hilux srv 			
10598390	Bóia Circular Mickey Mouse 56cm  91004 Bestway - E	bóia circular mickey mouse 			
10599463	Bumper Motorola Moto E Azul	Bumper Motorola Moto E Azul		azul	
10599530	Bumper Motorola Moto E Rosa	Bumper Motorola Moto E Rosa			
10599711	Capa Samsung T117 Flip Preto	Capa Samsung T117 Flip Preto		preto	
10604067	Capa Samsung Galaxy Fame/Fame Duos Pc Preto	Capa Samsung Galaxy Fame/Fame Duos Pc Preto		preto	
10604071	Capa Samsung Tab 3 7 Rotate Marrom	capa samsung tab 			
10604076	Capa Samsung Galaxy Fame Flip Preto	Capa Samsung Galaxy Fame Flip Preto		preto	
10604082	Capa Samsung Galaxy S4 Caveira Pc Preto	Capa Samsung Galaxy S4 Caveira Pc Preto		preto	
10604093	Capa Nokia 720 TPU Cinza	capa nokia 			
10604296	Capa Samsung Galaxy Fame Tpu Gel Cinza	Capa Samsung Galaxy Fame Tpu Gel Cinza			
10604335	Capa Samsung Galaxy S4 Pc Now Preto	Capa Samsung Galaxy S4 Pc Now Preto		preto	
10604703	Bumper Samsung Galaxy Fame Transparente/Branco	Bumper Samsung Galaxy Fame Transparente/Branco		branco	
10612144	Cooktop Fischer Vitrocerâmico 2 Bocas Preto Indução Elétrico 220V	cooktop fischer vitrocerâmico 		preto	
10613857	Co Tresemme Blindagem Platinum 400ml	co tresemme blindagem  		platinum	
10620382	Carboplex Malto 1kg - Advanced Nutrition-Neutro	carboplex malto 			
10620518	Exceed Energy Gel (cx c/ 10 uni) - Advanced Nutrition	exceed energy gel (cx c/ 			
10620628	Whey Muscle Hammer 900gr - Body Action	whey muscle hammer 			
10621534	Exceed Energy Gel (cx c/ 10 uni) - Advanced Nutrition	exceed energy gel (cx c/ 			
10621857	Colchão Casal Celebrity D-28 selado c/ Sistema Antiácaro, Antifungo e Antialérgico (188x138x17 cm)	Colchão Casal Celebrity D-28 selado c/ Sistema Antiácaro, Antifungo e Antialérgico (188x138x17 cm)			Antiácaro
10621920	Colchão Espuma D-20 Pro Luckspuma Selado Liso 12Cm - Solteiro 12x78x188 Cm	colchão espuma d-20 pro luckspuma selado liso 			
10622060	Exceed Energy Gel (cx c/ 10 uni) - Advanced Nutrition-Banana	exceed energy gel (cx c/ 			
10622291	Colchão Solteiro Supreme D-33 Selado C/ Sistema Antiácaro, Antifungo E Antialérgico (188x88x17 Cm)	Colchão Solteiro Supreme D-33 Selado C/ Sistema Antiácaro, Antifungo E Antialérgico (188x88x17 Cm)			Antiácaro
10624041	Corretivo Soft Dailus	Corretivo Soft Dailus			
10628258	Capa Samsung Galaxy Trend Lite S7392 Tpu Preto	Capa Samsung Galaxy Trend Lite S7392 Tpu Preto		preto	
10629579	Bumper Motorola Moto E Amarelo	Bumper Motorola Moto E Amarelo			
10630028	Exceed Energy Gel (cx c/ 10 uni) - Advanced Nutrition	exceed energy gel (cx c/ 			
10635362	Cooler Akasa Venom Voodoo - Universal Amd E Intel - Ak-Cc4008hp01	Cooler Akasa Venom Voodoo - Universal Amd E Intel - Ak-Cc4008hp01			
10635397	Water Cooler Corsair Hydro Series H80i Gt High Performance - Cw-9060017-Ww	Water Cooler Corsair Hydro Series H80i Gt High Performance - Cw-9060017-Ww			
10635467	Cabo Hdmi 1.4 - 10 Metros - 3d High Speed Full Hd - Gold Flash - Akasa - Ak-Cbhd02-100	cabo hdmi 			1.4
10635771	Shampoo Vichy Dercos Nutrirreparador	Shampoo Vichy Dercos Nutrirreparador			
10637282	Capa Flip Cover Samsung Galaxy Y Duos S6102 Preto	Capa Flip Cover Samsung Galaxy Y Duos S6102 Preto		preto	
10637317	Capa Flip Cover Samsung Galaxy Young Preto	Capa Flip Cover Samsung Galaxy Young Preto		preto	
